{
  "version": 1,
  "message_id": "10000000-0000-4000-8000-000000000004",
  "request_id": "20000000-0000-4000-8000-000000000002",
  "direction": "device_to_phone",
  "type": "action_request",
  "ttl_ms": 30000,
  "payload": {
    "action": "start_navigation",
    "candidate_id": "poi:001",
    "confirmation": "confirmed",
    "parent_request_id": "20000000-0000-4000-8000-000000000001"
  }
}
